Title,id,price,author,publisher,pub_year,s_tile,edition_num,description,availabe,sale_date,short_pub,num_of_author,width,height,cat_verification
Learning and Collaboration Technologies. Technology in Education,95795082,102.92547426,Panayiotis Zaphiris,Springer International Publishing,2017,"4th International Conference, LCT 2017, Held as Part of HCI International 2017, Vancouver, BC, Canada, July 9-14, 2017, Proceedings, Part II",,"The two-volume set LNCS 10295 and 10296 constitute the refereed proceedings of the 4th&nbsp;International Conference on Learning and Collaboration Technologies, LCT&nbsp;2017, held as part of the 19th International Conference...",True,2017-06-28T00:00:00,Jun 2017,2,97,150,UI_UX
"Human Aspects of IT for the Aged Population. Aging, Design and User Experience",95795083,73.51399426,Jia Zhou,Springer International Publishing,2017,"Third International Conference, ITAP 2017, Held as Part of HCI International 2017, Vancouver, BC, Canada, July 9-14, 2017, Proceedings, Part I",,"The two-volume set LNCS 10297 + 10298 constitutes the refereed proceedings of the Third International Conference on Human Aspects of IT for the Aged Population, ITAP 2017, held as part of HCI International 2017 in Vancouver, BC, Canada. HCII 2017...",True,2017-06-28T00:00:00,Jun 2017,2,97,150,UI_UX
"Human Aspects of IT for the Aged Population. Applications, Services and Contexts",95795084,73.51399426,Jia Zhou,Springer International Publishing,2017,"Third International Conference, ITAP 2017, Held as Part of HCI International 2017, Vancouver, BC, Canada, July 9-14, 2017, Proceedings, Part II",,"The two-volume set LNCS 10297 + 10298 constitutes the refereed proceedings of the Third International Conference on Human Aspects of IT for the Aged Population, ITAP 2017, held as part of HCI International 2017 in Vancouver, BC, Canada. HCII 2017...",True,2017-06-28T00:00:00,Jun 2017,2,97,150,UI_UX
Social Computing and Social Media. Human Behavior,95795085,73.51399426,Gabriele Meiselwitz,Springer International Publishing,2017,"9th International Conference, SCSM 2017, Held as Part of HCI International 2017, Vancouver, BC, Canada, July 9-14, 2017, Proceedings, Part I",,"This book constitutes the proceedings of the 9th International Conference on Social Computing and Social Media, SCSM 2017, held as part of the 19th International Conference on Human-Computer Interaction, HCII 2017, held in Vancouver, Canada, in...",True,2017-05-11T00:00:00,May 2017,1,97,150,UI_UX
Social Computing and Social Media. Applications and Analytics,95795086,73.51399426,Gabriele Meiselwitz,Springer International Publishing,2017,"9th International Conference, SCSM 2017, Held as Part of HCI International 2017, Vancouver, BC, Canada, July 9-14, 2017, Proceedings, Part II",,"This book constitutes the proceedings of the 9th International Conference on Social Computing and Social Media, SCSM 2017, held as part of the 19th International Conference on Human-Computer Interaction, HCII 2017, held in Vancouver, Canada, in...",True,2017-06-28T00:00:00,Jun 2017,1,97,150,UI_UX
Augmented Cognition. Enhancing Cognition and Behavior in Complex Human Environments,95795087,73.51399426,Dylan D. Schmorrow,Springer International Publishing,2017,"11th International Conference, AC 2017, Held as Part of HCI International 2017, Vancouver, BC, Canada, July 9-14, 2017, Proceedings, Part II",,"This volume constitutes the proceedings of the 11th International Conference on Augmented Cognition, AC 2017, held as part of the International Conference on Human-Computer Interaction, HCII 2017, which took place in Vancouver, BC, Canada, in July...",True,2017-06-28T00:00:00,Jun 2017,2,97,150,UI_UX
Augmented Cognition. Neurocognition and Machine Learning,95795088,73.51399426,Dylan D. Schmorrow,Springer International Publishing,2017,"11th International Conference, AC 2017, Held as Part of HCI International 2017, Vancouver, BC, Canada, July 9-14, 2017, Proceedings, Part I",,"This volume constitutes the proceedings of the 11th International Conference on Augmented Cognition, AC 2017, held as part of the International Conference on Human-Computer Interaction, HCII 2017, which took place in Vancouver, BC, Canada, in July...",True,2017-06-28T00:00:00,Jun 2017,2,97,150,UI_UX
"Design, User Experience, and Usability: Theory, Methodology, and Management",95795089,132.33695426,Aaron Marcus,Springer International Publishing,2017,"6th International Conference, DUXU 2017, Held as Part of HCI International 2017, Vancouver, BC, Canada, July 9-14, 2017, Proceedings, Part I",,"The three-volume set LNCS 10288, 10289, and 10290 constitutes the proceedings of the 6th International Conference on Design, User Experience, and Usability, DUXU 2017, held as part of the 19th International Conference on Human-Computer...",True,2017-06-28T00:00:00,Jun 2017,2,97,150,UI_UX
"Design, User Experience, and Usability: Designing Pleasurable Experiences",95795090,73.51399426,Aaron Marcus,Springer International Publishing,2017,"6th International Conference, DUXU 2017, Held as Part of HCI International 2017, Vancouver, BC, Canada, July 9-14, 2017, Proceedings, Part II",,"The three-volume set LNCS 10288, 10289, and 10290 constitutes the proceedings of the 6th International Conference on Design, User Experience, and Usability, DUXU 2017, held as part of the 19th International Conference on Human-Computer...",True,2017-06-28T00:00:00,Jun 2017,2,97,150,UI_UX
Cross-Cultural Design,95795071,73.51399426,Pei-Luen Patrick Rau,Springer International Publishing,2017,"9th International Conference, CCD 2017, Held as Part of HCI International 2017, Vancouver, BC, Canada, July 9-14, 2017, Proceedings",,"This book constitutes the proceedings of the 9th International Conference on Cross-Cultural Design, CCD 2017, held as part of the 19th International Conference on Human-Computer Interaction, HCII 2017, held in Vancouver, Canada, in July 2017. HCII...",True,2017-06-28T00:00:00,Jun 2017,1,97,150,UI_UX
"Virtual, Augmented and Mixed Reality",95795072,117.63121426,Stephanie Lackey,Springer International Publishing,2017,"9th International Conference, VAMR 2017, Held as Part of HCI International 2017, Vancouver, BC, Canada, July 9-14, 2017, Proceedings",,"This book constitutes the refereed proceedings of the 9th International Conference on Virtual, Augmented and Mixed Reality, VAMR 2017, held as part of HCI International 2017 in Vancouver, BC, Canada. HCII 2017 received a total of 4340 submissions,...",True,2017-06-28T00:00:00,Jun 2017,2,97,150,UI_UX
"Digital Human Modeling. Applications in Health, Safety, Ergonomics, and Risk Management: Ergonomics and Design",95795075,73.51399426,Vincent G. Duffy,Springer International Publishing,2017,"8th International Conference, DHM 2017, Held as Part of HCI International 2017, Vancouver, BC, Canada, July 9-14, 2017, Proceedings, Part I",,"The two-volume set LNCS 10286 + 10287 constitutes the refereed proceedings of the 8th International Conference on Digital Human Modeling and Applications in Health, Safety, Ergonomics, and Risk Management, DHM 2017, held as part of HCI...",True,2017-06-28T00:00:00,Jun 2017,1,97,150,UI_UX
"Digital Human Modeling. Applications in Health, Safety, Ergonomics, and Risk Management: Health and Safety",95795076,73.51399426,Vincent G. Duffy,Springer International Publishing,2017,"8th International Conference, DHM 2017, Held as Part of HCI International 2017, Vancouver, BC, Canada, July 9-14, 2017, Proceedings, Part II",,"The two-volume set LNCS 10286 + 10287 constitutes the refereed proceedings of the 8th International Conference on Digital Human Modeling and Applications in Health, Safety, Ergonomics, and Risk Management, DHM 2017, held as part of HCI...",True,2017-06-28T00:00:00,Jun 2017,1,97,150,UI_UX
"Engineering Psychology and Cognitive Ergonomics: Performance, Emotion and Situation Awareness",95795077,73.51399426,Don Harris,Springer International Publishing,2017,"14th International Conference, EPCE 2017, Held as Part of HCI International 2017, Vancouver, BC, Canada, July 9-14, 2017, Proceedings, Part I",,"This book constitutes the proceedings of the 14th International Conference on Engineering Psychology and Cognitive Ergonomics, EPCE 2017, held in Vancouver, Canada, in July 2017. HCII 2017 received a total of 4340 submissions, of which 1228 papers...",True,2017-06-28T00:00:00,Jun 2017,1,97,150,UI_UX
Engineering Psychology and Cognitive Ergonomics: Cognition and Design,95795078,73.51399426,Don Harris,Springer International Publishing,2017,"14th International Conference, EPCE 2017, Held as Part of HCI International 2017, Vancouver, BC, Canada, July 9-14, 2017, Proceedings, Part II",,"This book constitutes the proceedings of the 14th International Conference on Engineering Psychology and Cognitive Ergonomics, EPCE 2017, held in Vancouver, Canada, in July 2017. HCII 2017 received a total of 4340 submissions, of which 1228 papers...",True,2017-06-28T00:00:00,Jun 2017,1,97,150,UI_UX
Learning and Collaboration Technologies. Novel Learning Ecosystems,95795081,73.51399426,Panayiotis Zaphiris,Springer International Publishing,2017,"4th International Conference, LCT 2017, Held as Part of HCI International 2017, Vancouver, BC, Canada, July 9-14, 2017, Proceedings, Part I",,"The two-volume set LNCS 10295 and 10296 constitute the refereed proceedings of the 4th&nbsp;International Conference on Learning and Collaboration Technologies, LCT&nbsp;2017, held as part of the 19th International Conference...",True,2017-06-28T00:00:00,Jun 2017,2,97,150,UI_UX
"Design, User Experience, and Usability: Understanding Users and Contexts",95795091,132.33695426,Aaron Marcus,Springer International Publishing,2017,"6th International Conference, DUXU 2017, Held as Part of HCI International 2017, Vancouver, BC, Canada, July 9-14, 2017, Proceedings, Part III",,"The three-volume set LNCS 10288, 10289, and 10290 constitutes the proceedings of the 6th International Conference on Design, User Experience, and Usability, DUXU 2017, held as part of the 19th International Conference on Human-Computer...",True,2017-06-28T00:00:00,Jun 2017,2,97,150,UI_UX
Universal Access in Human–Computer Interaction. Human and Technological Environments,95795092,73.51399426,Margherita Antona,Springer International Publishing,2017,"11th International Conference, UAHCI 2017, Held as Part of HCI International 2017, Vancouver, BC, Canada, July 9–14, 2017, Proceedings, Part III",,"The three-volume set LNCS 10277-10279 constitutes the refereed proceedings of the11th International Conference on Universal Access in Human-Computer Interaction, UAHCI 2017, held as part of the 19th International Conference on Human-Computer...",True,2017-06-28T00:00:00,Jun 2017,2,97,150,UI_UX
Universal Access in Human–Computer Interaction. Designing Novel Interactions,95795093,73.51399426,Margherita Antona,Springer International Publishing,2017,"11th International Conference, UAHCI 2017, Held as Part of HCI International 2017, Vancouver, BC, Canada, July 9–14, 2017, Proceedings, Part II",,"The three-volume set LNCS 10277-10279 constitutes the refereed proceedings of the11th International Conference on Universal Access in Human-Computer Interaction, UAHCI 2017, held as part of the 19th International Conference on Human-Computer...",True,2017-06-28T00:00:00,Jun 2017,2,97,150,UI_UX
Universal Access in Human–Computer Interaction. Design and Development Approaches and Methods,95795094,73.51399426,Margherita Antona,Springer International Publishing,2017,"11th International Conference, UAHCI 2017, Held as Part of HCI International 2017, Vancouver, BC, Canada, July 9–14, 2017, Proceedings, Part I",,"The three-volume set LNCS 10277-10279 constitutes the refereed proceedings of the11th International Conference on Universal Access in Human-Computer Interaction, UAHCI 2017, held as part of the 19th International Conference on Human-Computer...",True,2017-06-28T00:00:00,Jun 2017,2,97,150,UI_UX
Building an Intuitive Multimodal Interface for a Smart Home,95821080,73.51399426,John N.A Brown,Springer International Publishing,2017,Hunting the SNARK,,"This book describes an innovative approach to the interaction between humans and a smart environment; an attempt to get a smart home to understand intuitive, multi-modal, human-centred communication. State of the art smart homes, like other...",True,2017-05-03T00:00:00,May 2017,3,97,150,UI_UX
Toward Brain-Computer Interaction in Paralysis,95821078,73.51399426,Anibal Cotrina,Springer International Publishing,2017,A New Approach Based on Visual Evoked Potentials and Depth-of-Field,,"This book presents up-to-date information on Brain-computer Interfaces (BCI).BCIs are systems that record brain signals, extract features and translate them into computer commands. For instance, in BCIs based on the steady-state visual evoked...",True,2017-04-07T00:00:00,Apr 2017,1,97,150,UI_UX
HCI for Children with Disabilities,95821079,132.33695426,Josefina Guerrero-Garcia,Springer International Publishing,2017,,,In this book the authors present an HCI principle-based approach to develop applications to assist children with disabilities. Design knowledge related to developing complex solution for this audience is explained from an interaction design point...,True,2017-05-03T00:00:00,May 2017,4,97,150,UI_UX
New Perspectives in End-User Development,95839001,205.86565426,Fabio Paternò,Springer International Publishing,2017,,,"This book provides an in-depth insight into the emerging paradigm of End-User Development (EUD), discussing the diversity and potential for creating effective environments for end users. Containing a unique set of contributions from a number of...",True,2017-08-09T00:00:00,Aug 2017,2,97,150,UI_UX
Computing in Smart Toys,95839036,132.33695426,Jeff K.T. Tang,Springer International Publishing,2017,,,The goal of this book is to crystallize the emerging mobile computing technologies and trends into positive efforts to focus on the most promising solutions in services computing. Many toys built today are increasingly using these technologies...,True,2017-08-10T00:00:00,Aug 2017,2,97,150,UI_UX
Brain-Computer Interface Research,95847981,80.86686426,Christoph Guger,Springer International Publishing,2017,A State-of-the-Art Summary 6,,"This book presents compact and informative descriptions of the most promising new projects in brain-computer interface (BCI) research. As in earlier volumes in this series, the contributions come from many of the best-known groups in BCI research....",True,2017-08-21T00:00:00,Aug 2017,3,97,150,UI_UX
Predicting User Performance and Errors,95824938,132.33695426,Marc Halbrügge,Springer International Publishing,2017,Automated Usability Evaluation Through Computational Introspection of Model-Based User Interfaces,,"This book proposes a combination of cognitive modeling with model-based user interface development to tackle the problem of maintaining the usability of applications that target several device types at once (e.g., desktop PC, smart phone, smart...",True,2017-07-20T00:00:00,Jul 2017,1,97,150,UI_UX
Collaboration Technologies and Social Computing,95833370,73.51399426,Takashi Yoshino,Springer International Publishing,2017,"9th International Conference, CollabTech 2017, Saskatoon, SK, Canada, August 8–10, 2017, Proceedings",,"This book constitutes the refereed proceedings of the 9th International Conference on Collaboration Technologies, CollabTech 2017, held in Saskatoon, SK, Canada, in August 2017.The 10 revised full papers presented in this book together with 6...",True,2017-08-01T00:00:00,Aug 2017,4,97,150,UI_UX
Bridging People and Sound,95865511,73.51399426,Mitsuko Aramaki,Springer International Publishing,2017,"12th International Symposium, CMMR 2016, São Paulo, Brazil, July 5–8, 2016, Revised Selected Papers",,"This book constitutes the thoroughly refereed post-conference of the 12th International Symposium on Computer Music Modeling and Retrieval, CMMR 2016, held in São Paulo, Brazil, in July 2016. The 22 full papers presented were carefully...",True,2017-09-15T00:00:00,Sep 2017,3,97,150,UI_UX
Advances in Usability and User Experience,95792994,205.86565426,Tareq Ahram,Springer International Publishing,2017,"Proceedings of the AHFE 2017 International Conference on Usability and User Experience, July 17-21, 2017, The Westin Bonaventure Hotel, Los Angeles, California, USA",,"This book focuses on emerging issues in usability, interface design, human computer interaction and user experience, with a special emphasis on the research aimed at understanding human-interaction and usability issues with products, services and...",True,2017-06-22T00:00:00,Jun 2017,2,97,150,UI_UX
"Cooperative Design, Visualization, and Engineering",95859679,73.51399426,Yuhua Luo,Springer International Publishing,2017,"14th International Conference, CDVE 2017, Mallorca, Spain, September 17-20, 2017, Proceedings",,"This book constitutes the refereed proceedings of the 14th International Conference on Cooperative Design, Visualization, and Engineering, CDVE 2017, held in Mallorca, Spain, in September 2017.The 31 full papers presented in this book together...",True,2017-09-08T00:00:00,Sep 2017,1,97,150,UI_UX
The Handbook of Formal Methods in Human-Computer Interaction,95789270,424.995886,Benjamin Weyers,Springer International Publishing,2017,,,"This book provides a comprehensive collection of methods and approaches for using formal methods within Human-Computer Interaction (HCI) research, the use of which is a prerequisite for usability and user-experience (UX) when engineering...",True,2017-04-24T00:00:00,Apr 2017,4,97,150,UI_UX
Eye Tracking Methodology,95789296,98.51375226,Andrew T. Duchowski,Springer International Publishing,2017,Theory and Practice, (3rd ed.),"&lt;p&gt;This book focuses on video-based, corneal-reflection eye trackers – the most widely available and affordable type of system, and takes a look at a number of interesting and challenging applications in human factors, collaborative systems,...",True,2017-05-24T00:00:00,May 2017,1,97,150,UI_UX
Five Design-Sheets: Creative Design and Sketching for Computing and Visualisation,95790134,80.86686426,Jonathan C. Roberts,Springer International Publishing,2017,,,"This book describes a structured sketching methodology to help you create alternative design ideas and sketch them on paper. The Five Design-Sheet method acts as a check-list of tasks, to help you think through the problem, create new ideas and to...",True,2017-05-28T00:00:00,May 2017,3,97,150,UI_UX
Human Centered Software Product Lines,95882401,132.33695426,Jean-Sébastien Sottet,Springer International Publishing,2017,,,This book takes a unique HCI approach to the concept of Software Product Line (SPL) and discusses the peculiarities of human-computer interaction not usually addressed in more traditional approaches. SPL is based on industrial practices for...,True,2017-10-05T00:00:00,Oct 2017,3,97,150,UI_UX
Community Informatics Design Applied to Digital Social Systems,95925156,132.33695426,Pierre-Léonard Harvey,Springer International Publishing,2017,"Communicational Foundations, Theories and Methodologies",,"This book introduces a Digital Social System Praxis Framework (DSSPF) integrating Computational Media, Evolutionary Systems Thinking and Design Thinking approaches to E-transformation practice, also called Community Informatics Design (CID). The...",True,2017-12-05T00:00:00,Dec 2017,2,97,150,UI_UX
Natural Interaction in Medical Training,95919330,73.51399426,Alberto Del Bimbo,Springer International Publishing,2017,Tools and Applications,,"This book covers state of the art techniques for health personnel training using natural interfaces, immersive systems and serious games paradigms. Opening with a comprehensive introduction to the state of immersive visualisation techniques of...",True,2017-11-28T00:00:00,Nov 2017,4,97,150,UI_UX
A Psychology of User Experience,95923850,176.45417426,Phil Turner,Springer International Publishing,2017,"Involvement, Affect and Aesthetics",,"It is well-established that while cognitive psychology provides a sound foundation for an understanding of our interactions with digital technology, this is no longer sufficient to make sense of how we use and experience the personal, relational...",True,2017-12-02T00:00:00,Dec 2017,1,97,150,UI_UX
Research and Development in Digital Media,95948936,73.51399426,Rae Earnshaw,Springer International Publishing,2018,,,"This book presents an overview of the technical underpinnings in the field of digital media. This includes theory, imaging, big data, interaction, and the research and development that is needed in order to make digital media interfaces more natural...",True,2018-01-30T00:00:00,Jan 2018,1,97,150,UI_UX
Evaluation in the Crowd. Crowdsourcing and Human-Centered Experiments,95875271,73.51399426,Daniel Archambault,Springer International Publishing,2017,"Dagstuhl Seminar 15481, Dagstuhl Castle, Germany, November 22 – 27, 2015, Revised Contributions",,"As the outcome of the Dagstuhl Seminar 15481 on Crowdsourcing and Human-Centered Experiments, this book is a primer for computer science researchers who intend to use crowdsourcing technology for human centered experiments. The focus of this...",True,2017-09-27T00:00:00,Sep 2017,3,97,150,UI_UX
Smart Homes and Their Users,95875308,80.86686426,Tom Hargreaves,Springer International Publishing,2017,,,"Smart home technologies promise to transform domestic comfort, convenience, security and leisure while also reducing energy use. But delivering on these potentially conflicting promises depends on how they are adopted and used in homes. This...",True,2017-09-25T00:00:00,Sep 2017,2,97,150,UI_UX
Cognition Beyond the Brain,95879984,176.45417426,Stephen J. Cowley,Springer International Publishing,2017,"Computation, Interactivity and Human Artifice", (2nd ed.),"This book challenges neurocentrism by advocating a systemic view of cognition based on investigating how action shapes the experience of thinking, placing interactivity at its heart. This systemic viewpoint makes three main claims. First, that...",True,2017-03-28T00:00:00,Mar 2017,2,97,150,UI_UX
Human-Computer Interaction - INTERACT 2017,95867485,73.51399426,Regina Bernhaupt,Springer International Publishing,2017,"16th IFIP TC 13 International Conference, Mumbai, India, September 25-29, 2017, Proceedings, Part II",,"The four-volume set LNCS 10513—10516 constitutes the proceedings of the 16th IFIP TC 13 International Conference on Human-Computer Interaction, INTERACT 2017, held in Mumbai, India, in September 2017. The total of 68 papers presented in these...",True,2017-09-19T00:00:00,Sep 2017,6,97,150,UI_UX
Human-Computer Interaction - INTERACT 2017,95867486,73.51399426,Regina Bernhaupt,Springer International Publishing,2017,"16th IFIP TC 13 International Conference, Mumbai, India, September 25–29, 2017, Proceedings, Part I",,"The four-volume set LNCS 10513—10516 constitutes the proceedings of the 16th IFIP TC 13 International Conference on Human-Computer Interaction, INTERACT 2017, held in Mumbai, India, in September 2017. The total of 68 papers presented in these...",True,2017-09-19T00:00:00,Sep 2017,6,97,150,UI_UX
Human-Computer Interaction – INTERACT 2017,95867955,73.51399426,Regina Bernhaupt,Springer International Publishing,2017,"16th IFIP TC 13 International Conference, Mumbai, India, September 25-29, 2017, Proceedings, Part IV",,"The four-volume set LNCS 10513—10516 constitutes the proceedings of the 16th IFIP TC 13 International Conference on Human-Computer Interaction, INTERACT 2017, held in Mumbai, India, in September 2017. The total of 68 papers presented in these...",True,2017-09-20T00:00:00,Sep 2017,6,97,150,UI_UX
Human-Computer Interaction – INTERACT 2017,95867954,73.51399426,Regina Bernhaupt,Springer International Publishing,2017,"16th IFIP TC 13 International Conference, Mumbai, India, September 25–29, 2017, Proceedings, Part III",,"The four-volume set LNCS 10513—10516 constitutes the proceedings of the 16th IFIP TC 13 International Conference on Human-Computer Interaction, INTERACT 2017, held in Mumbai, India, in September 2017. The total of 68 papers presented in these...",True,2017-09-19T00:00:00,Sep 2017,6,97,150,UI_UX
Conversations Around Semiotic Engineering,95895159,132.33695426,Simone Diniz Junqueira Barbosa,Springer International Publishing,2017,,,"Demonstrating the influence of Semiotic Engineering in Human-Computer Interaction, this book focuses on the work of one of the pioneers of the field - Clarisse de Souza &nbsp;- and her influence on this broad and wide-ranging area of research. It...",True,2017-05-09T00:00:00,May 2017,2,97,150,UI_UX
ICTs for Improving Patients Rehabilitation Research Techniques,95911504,73.51399426,Habib M. Fardoun,Springer International Publishing,2017,"Third International Workshop, REHAB 2015, Lisbon, Portugal, October 1-2, 2015, Revised Selected Papers",,"This book constitutes the thoroughly refereed proceedings of the Third International Workshop on ICTs for Improving Patients Rehabilitation Research Techniques, REHAB 2015, held in Lisbon, Portugal, in October 2015.The 15 revised full papers...",True,2017-11-13T00:00:00,Nov 2017,4,97,150,UI_UX
Mobile e-Health,95922273,132.33695426,Hannah R. Marston,Springer International Publishing,2017,,,"This multi-disciplinary collection of essays captures discussion, thinking and research surrounding the recent surge of interest in how technology can help us as we age. A wide range of topics are covered, from investigations in the use of...",True,2017-12-01T00:00:00,Dec 2017,3,97,150,UI_UX
