Title,id,price,author,publisher,pub_year,s_tile,edition_num,description,availabe,sale_date,short_pub,num_of_author,width,height,cat_verification
"Cross-Cultural Design. Applications in Learning, Arts, Cultural Heritage, Creative Industries, and Virtual Reality",210591504,161.74843426,Pei-Luen Patrick Rau,Springer International Publishing,2022,"14th International Conference, CCD 2022, Held as Part of the 24th HCI International Conference, HCII 2022, Virtual Event, June 26 – July 1, 2022, Proceedings, Part II",,"The four-volume set LNCS 13311 - 13314 constitutes the refereed proceedings of the 14th International Conference on Cross-Cultural Design, CCD 2022, which was held as part of HCI International 2022 and took place virtually during June 26 - July 1,...",True,2022-06-16T00:00:00,Jun 2022,1,97,150,UI_UX
HCI International 2022 Posters,210591556,117.63121426,Constantine Stephanidis,Springer International Publishing,2022,"24th International Conference on Human-Computer Interaction, HCII 2022, Virtual Event, June 26 – July 1, 2022, Proceedings, Part II",,"The four-volume set CCIS 1580, CCIS 1581, CCIS 1582, and CCIS 1583 contains the extended abstracts of the posters presented during the 24th International Conference on Human-Computer Interaction, HCII 2022, which was held virtually in June - July...",True,2022-06-16T00:00:00,Jun 2022,3,97,150,UI_UX
Computers Helping People with Special Needs,210608031,,Klaus Miesenberger,Springer International Publishing,2022,"18th International Conference, ICCHP-AAATE 2022, Lecco, Italy, July 11–15, 2022, Proceedings, Part I",,"The two-volume set LNCS 13341 and 13342 constitutes the refereed proceedings of the Joint International Conference on Digital Inclusion, Assistive Technology, and Accessibility, ICCHP-AAATE 2022. The conference was held in Lecco, Italy, in July...",False,2022-07-01T00:00:00,Jul 2022,6,97,150,UI_UX
Computers Helping People with Special Needs,210608030,102.92547426,Klaus Miesenberger,Springer International Publishing,2022,"18th International Conference, ICCHP-AAATE 2022, Lecco, Italy, July 11–15, 2022, Proceedings, Part II",,"The two-volume set LNCS 13341 and 13342 constitutes the refereed proceedings of the Joint International Conference on Digital Inclusion, Assistive Technology, and Accessibility, ICCHP-AAATE 2022. The conference was held in Lecco, Italy, in July...",True,2022-07-01T00:00:00,Jul 2022,6,97,150,UI_UX
HCI International 2022 Posters,210594776,132.33695426,Constantine Stephanidis,Springer International Publishing,2022,"24th International Conference on Human-Computer Interaction, HCII 2022, Virtual Event, June 26 – July 1, 2022, Proceedings, Part I",,"The four-volume set CCIS 1580, CCIS 1581, CCIS 1582, and CCIS 1583 contains the extended abstracts of the posters presented during the 24th International Conference on Human-Computer Interaction, HCII 2022, which was held virtually in June - July...",True,2022-06-21T00:00:00,Jun 2022,3,97,150,UI_UX
Experience-Centered Design,210576303,36.74964426,Peter Wright,Springer International Publishing,2022,"Designers, Users, and Communities in Dialogue",,"Experience-centered design, experience-based design, experience design, designing for experience, user experience design. All of these terms have emerged and gained acceptance in the Human-Computer Interaction (HCI) and Interaction Design...",True,2022-05-31T00:00:00,May 2022,2,97,150,UI_UX
Designing and Evaluating Usable Technology in Industrial Research,210576305,39.69079226,Clare-Marie Karat,Springer International Publishing,2022,Three Case Studies,,"This book is about HCI research in an industrial research setting. It is based on the experiences of two researchers at the IBM T. J. Watson Research Center. Over the last two decades, Drs. John and Clare-Marie Karat have conducted HCI research to...",True,2022-05-31T00:00:00,May 2022,2,97,150,UI_UX
Context-Aware Mobile Computing,210576307,29.39677426,Geri Gay,Springer International Publishing,2022,"Affordances of Space, Social Awareness, and Social Influence",,"The integration of ubiquitous mobile computing resources into physical spaces can potentially affect the development, maintenance, and transformation of communities and social interactions and relations within a particular context or location....",True,2022-05-31T00:00:00,May 2022,1,97,150,UI_UX
Studies of Work and the Workplace in HCI,210576296,36.74964426,Graham Button,Springer International Publishing,2022,Concepts and Techniques,,"This book has two purposes. First, to introduce the study of work and the workplace as a method for informing the design of computer systems to be used at work. We primarily focus on the predominant way in which the organization of work has been...",True,2022-05-31T00:00:00,May 2022,2,97,150,UI_UX
Interacting with Information,210576302,36.74964426,Ann Blandford,Springer International Publishing,2022,,,"We live in an ""information age,"" but information is only useful when it is interpreted by people and applied in the context of their goals and activities. The volume of information to which people have access is growing at an incredible rate,...",True,2022-05-31T00:00:00,May 2022,2,97,150,UI_UX
Common Ground in Electronically Mediated Conversation,210576313,29.39677426,Andrew Monk,Springer International Publishing,2022,,,"Technologies that electronically mediate conversation, such as text-based chat or desktop video conferencing, draw on theories of human−human interaction to make predictions about the effects of design decisions. This lecture reviews the theory...",True,2022-05-31T00:00:00,May 2022,1,97,150,UI_UX
Activity Theory in HCI,210576314,39.69079226,Victor Kaptelinin,Springer International Publishing,2022,Fundamentals and Reflections,,"Activity theory -- a conceptual framework originally developed by Aleksei Leontiev -- has its roots in the socio-cultural tradition in Russian psychology. The foundational concept of the theory is human activity, which is understood as purposeful, mediated, and transformative interaction between human beings and the world. Since the...",True,2022-05-31T00:00:00,May 2022,2,97,150,UI_UX
Making Claims,210576315,39.69079226,D. Scott McCrickard,Springer International Publishing,2022,"Knowledge Design, Capture, and Sharing in HCI",,"Human-centered informatics (HCI) is a young discipline that is still defining its core components, with approaches rooted in engineering, science, and creative design. In the spirit of this book series, this book explores HCI as an intersection...",True,2022-05-31T00:00:00,May 2022,1,97,150,UI_UX
Mobile Interactions in Context,210576316,48.51423626,Jesper Kjeldskov,Springer International Publishing,2022,A Designerly Way Toward Digital Ecology,,"This book presents a contextual approach to designing contemporary interactive mobile computer systems as integral parts of ubiquitous computing environments. Interactive mobile systems, services, and devices have become functional design objects...",True,2022-05-31T00:00:00,May 2022,1,97,150,UI_UX
Designing for User Engagment,210576317,29.39677426,Alistair Sutcliffe,Springer International Publishing,2022,Aesthetic and Attractive User Interfaces,,"This book explores the design process for user experience and engagement, which expands the traditional concept of usability and utility in design to include aesthetics, fun and excitement. User experience has evolved as a new area of Human...",True,2022-05-31T00:00:00,May 2022,1,97,150,UI_UX
How We Cope with Digital Technology,210576318,39.69079226,Phil Turner,Springer International Publishing,2022,,,"Digital technology has become a defining characteristic of modern life. Almost everyone uses it, we all rely on it, and many of us own a multitude of devices. What is more, we all expect to be able to use these technologies ""straight out the box.""...",True,2022-06-01T00:00:00,Jun 2022,1,97,150,UI_UX
Core-Task Design,210576326,51.45538426,Leena Norros,Springer International Publishing,2022,A Practice-Theory Approach to Human Factors,,"This book focuses on design of work from the human-factors (HF) perspective. In the approach referred to as Core-Task Design (CTD), work is considered practice, composed of human actors, the physical and social environment, and the tools used for...",True,2022-06-01T00:00:00,Jun 2022,3,97,150,UI_UX
Constructing Knowledge Art,210576327,66.16112426,Al Selvin,Springer International Publishing,2022,An Experiential Perspective on Crafting Participatory Representations,,"This book is about how people (we refer to them as practitioners) can help guide participants in creating representations of issues or ideas, such as collaborative diagrams, especially in the context of Participatory Design (PD). At its best, such...",True,2022-05-31T00:00:00,May 2022,2,97,150,UI_UX
Semiotic Engineering Methods for Scientific Research in HCI,210576328,39.69079226,Clarisse Sieckenius de Souza,Springer International Publishing,2022,,,"Semiotic engineering was originally proposed as a semiotic approach to designing user interface languages. Over the years, with research done at the Department of Informatics of the Pontifical Catholic University of Rio de Janeiro, it evolved into...",True,2022-06-01T00:00:00,Jun 2022,2,97,150,UI_UX
Experience Design,210576332,39.69079226,Marc Hassenzahl,Springer International Publishing,2022,Technology for All the Right Reasons,,"In his In the blink of an eye, Walter Murch, the Oscar-awarded editor of The English Patient, Apocalypse Now, and many other outstanding movies, devises the Rule of Six -- six criteria for what makes a good cut. On top of his list is ""to be true...",True,2022-05-31T00:00:00,May 2022,1,97,150,UI_UX
Designing for Gesture and Tangible Interaction,210576335,58.80825426,Mary Lou Maher,Springer International Publishing,2022,,,"Interactive technology is increasingly integrated with physical objects that do not have a traditional keyboard and mouse style of interaction, and many do not even have a display. These objects require new approaches to interaction design,...",True,2022-05-31T00:00:00,May 2022,2,97,150,UI_UX
The Paradigm Shift to Multimodality in Contemporary Computer Interfaces,210576336,73.51399426,Sharon Oviatt,Springer International Publishing,2022,,,"During the last decade, cell phones with multimodal interfaces based on combined new media have become the dominant computer interface worldwide. Multimodal interfaces support mobility and expand the expressive power of human input to computers....",True,2022-06-01T00:00:00,Jun 2022,2,97,150,UI_UX
An Anthropology of Services,210576337,36.74964426,Jeanette Blomberg,Springer International Publishing,2022,Toward a Practice Approach to Designing Services,,This book explores the possibility for an anthropology of services and outlines a practice approach to designing services. The reader is taken on a journey that Blomberg and Darrah have been on for the better part of a decade from their respective...,True,2022-06-01T00:00:00,Jun 2022,2,97,150,UI_UX
Research in the Wild,210576338,51.45538426,Yvonne Rogers,Springer International Publishing,2022,,,"The phrase ""in-the-wild"" is becoming popular again in the field of human-computer interaction (HCI), describing approaches to HCI research and accounts of user experience phenomena that differ from those derived from other lab-based methods. The...",True,2022-05-31T00:00:00,May 2022,2,97,150,UI_UX
Human-Computer Interactions in Museums,210576341,80.86686426,Eva Hornecker,Springer International Publishing,2022,,,"&lt;p&gt;Museums have been a domain of study and design intervention for Human-Computer Interaction (HCI) for several decades. However, while resources providing overviews on the key issues in the scholarship have been produced in the fields of...",True,2022-05-31T00:00:00,May 2022,2,97,150,UI_UX
Encounters with HCI Pioneers,210576342,80.86686426,Ben Shneiderman,Springer International Publishing,2022,A Personal History and Photo Journal,,"The huge success of personal computing technologies has brought astonishing benefits to individuals, families, communities, businesses, and government, transforming human life, largely for the better. These democratizing transformations happened...",True,2022-05-31T00:00:00,May 2022,1,97,150,UI_UX
Geographical Design,210576346,77.92571626,Stephen C Hirtle,Springer International Publishing,2022,"Spatial Cognition and Geographical Information Science, Second Edition", (2nd ed.),"With spatial technologies ranging from mapping software to the use of location-based services, spatial knowledge is often acquired and communicated through geographic information technologies. This book describes the interplay between spatial...",True,2022-05-31T00:00:00,May 2022,1,97,150,UI_UX
The Trouble With Sharing,210576350,80.86686426,Airi Lampinen,Springer International Publishing,2022,Interpersonal Challenges in Peer-to-Peer Exchange,,"Peer-to-peer exchange is a type of sharing that involves the transfer of valued resources, such as goods and services, among members of a local community and/or between parties who have not met before the exchange encounter. It involves online...",True,2022-05-31T00:00:00,May 2022,1,97,150,UI_UX
HCI Design Knowledge,210576356,80.86686426,Long John,Springer International Publishing,2022,"Critique, Challenge, and a Way Forward",,This is the first of two books concerned with engineering design principles for Human-Computer Interaction-Engineering Design Principles (HCI-EDPs). The book presents the background for the companion volume. The background is divided into three...,True,2022-05-31T00:00:00,May 2022,3,97,150,UI_UX
"Worth-Focused Design, Book 2",210576357,88.21973426,Gilbert Cockton,Springer International Publishing,2022,"Approaches, Context, and Case Studies",,"This book introduces the concept of worth for design teams, relates it to experiences and outcomes, and describes how to focus on worth when researching and expressing design opportunities for generous worth. Truly interdisciplinary teams also...",True,2022-05-31T00:00:00,May 2022,1,97,150,UI_UX
"Worth-Focused Design, Book 1",210576359,80.86686426,Gilbert Cockton,Springer International Publishing,2022,"Balance, Integration, and Generosity",,"Design now has many meanings. For some, it is the creation of value. For others, it is the conception and creation of artefacts. For still others it is fitting things to people. These differences reflect disciplinary values that both overlap and...",True,2022-05-31T00:00:00,May 2022,1,97,150,UI_UX
Qualitative HCI Research,210576360,58.80825426,Ann Blandford,Springer International Publishing,2022,Going Behind the Scenes,,"Human-Computer Interaction (HCI) addresses problems of interaction design: understanding user needs to inform design, delivering novel designs that meet user needs, and evaluating new and existing designs to determine their success in meeting user needs. Qualitative methods have an essential role to play in this enterprise,...",True,2022-05-31T00:00:00,May 2022,3,97,150,UI_UX
Participatory Design,210576367,80.86686426,Susanne Bødker,Springer International Publishing,2022,,,"This book introduces Participatory Design to researchers and students in Human–Computer Interaction (HCI). Grounded in four strong commitments, the book discusses why and how Participatory Design is important today. The book aims to provide...",True,2022-05-31T00:00:00,May 2022,4,97,150,UI_UX
Data-Driven Personas,210576387,95.57260426,Bernard J. Jansen,Springer International Publishing,2022,,,Data-driven personas are a significant advancement in the fields of human-centered informatics and human-computer interaction. Data-driven personas enhance user understanding by combining the empathy inherent with personas with the rationality...,True,2022-05-31T00:00:00,May 2022,4,97,150,UI_UX
User-Centered Agile Methods,210576319,29.39677426,Hugh Beyer,Springer International Publishing,2022,,,"With the introduction and popularization of Agile methods of software development, existing relationships and working agreements between user experience groups and developers are being disrupted. Agile methods introduce new concepts: the Product...",True,2022-06-01T00:00:00,Jun 2022,1,97,150,UI_UX
Translating Euclid,210576320,58.80825426,Gerry Stahl,Springer International Publishing,2022,Designing a Human-Centered Mathematics,,Translating Euclid reports on an effort to transform geometry for students from a stylus-and-clay-tablet corpus of historical theorems to a stimulating computer-supported collaborative-learning inquiry experience. The origin of geometry was a...,True,2022-05-31T00:00:00,May 2022,1,97,150,UI_UX
The Design of Implicit Interactions,210576321,36.74964426,Wendy Ju,Springer International Publishing,2022,,,"People rely on implicit interaction in their everyday interactions with one another to exchange queries, offers, responses, and feedback without explicit communication. A look with the eyes, a wave of the hand, the lift of the door handle—small...",True,2022-05-31T00:00:00,May 2022,1,97,150,UI_UX
Working Together Apart,210576322,58.80825426,Judy S. Olson,Springer International Publishing,2022,Collaboration over the Internet,,"Increasingly, teams are working together when they are not in the same location, even though there are many challenges to doing so successfully. Here we review the latest insights into these matters, guided by a framework that we have developed...",True,2022-05-31T00:00:00,May 2022,2,97,150,UI_UX
Surface Computing and Collaborative Analysis Work,210576324,58.80825426,Judith Brown,Springer International Publishing,2022,,,"Large surface computing devices (wall-mounted or tabletop) with touch interfaces and their application to collaborative data analysis, an increasingly important and prevalent activity, is the primary topic of this book. Our goals are to outline...",True,2022-05-31T00:00:00,May 2022,5,97,150,UI_UX
Contextual Design,210576325,39.69079226,Karen Holtzblatt,Springer International Publishing,2022,Evolved,,Contextual Design is a user-centered design process that uses in-depth field research to drive innovative design. Contextual Design was first invented in 1988 and has since been used in a wide variety of industries and taught in universities all...,True,2022-05-31T00:00:00,May 2022,2,97,150,UI_UX
From Tool to Partner,210576329,77.92571626,Jonathan Grudin,Springer International Publishing,2022,The Evolution of Human-Computer Interaction,,"This is the first comprehensive history of human-computer interaction (HCI). Whether you are a user-experience professional or an academic researcher, whether you identify with computer science,human factors, information systems, information...",True,2022-05-31T00:00:00,May 2022,1,97,150,UI_UX
Adaptive Interaction,210576331,39.69079226,Stephen J. Payne,Springer International Publishing,2022,A Utility Maximization Approach to Understanding Human Interaction with Technology,,"This lecture describes a theoretical framework for the behavioural sciences that holds high promise for theory-driven research and design in Human-Computer Interaction. The framework is designed to tackle the adaptive, ecological, and bounded...",True,2022-06-01T00:00:00,Jun 2022,2,97,150,UI_UX
Multitasking in the Digital Age,210576334,58.80825426,Gloria Mark,Springer International Publishing,2022,,,"In our digital age we can communicate, access, create, and share an abundance of information effortlessly, rapidly, and nearly ubiquitously. The consequence of having so many choices is that they compete for our attention: we continually switch...",True,2022-05-31T00:00:00,May 2022,1,97,150,UI_UX
Learner-Centered Design of Computing Education,210576339,73.51399426,Mark Guzdial,Springer International Publishing,2022,Research on Computing for Everyone,,Computing education is in enormous demand. Many students (both children and adult) are realizing that they will need programming in the future. This book presents the argument that they are not all going to use programming in the same way and for...,True,2022-05-31T00:00:00,May 2022,1,97,150,UI_UX
Proxemic Interactions,210576340,66.16112426,Nicolai Marquardt,Springer International Publishing,2022,From Theory to Practice,,"In the everyday world, much of what we do as social beings is dictated by how we perceive and manage our interpersonal space. This is called proxemics. At its simplest, people naturally correlate physical distance to social distance. We believe...",True,2022-05-31T00:00:00,May 2022,2,97,150,UI_UX
"Spaces of Interaction, Places for Experience",210576343,48.51423626,David Benyon,Springer International Publishing,2022,,,"Spaces of Interaction, Places for Experience is a book about Human-Computer Interaction (HCI), interaction design (ID) and user experience (UX) in the age of ubiquitous computing. The book explores interaction and experience through the different...",True,2022-06-01T00:00:00,Jun 2022,1,97,150,UI_UX
"Representation, Inclusion, and Innovation",210576344,88.21973426,Clayton Lewis,Springer International Publishing,2022,Multidisciplinary Explorations,,"A representation is a thing that can be interpreted as providing information about something: a map, or a graph, for example. This book is about the expanding world of computational representations, representations that use the power of...",True,2022-05-31T00:00:00,May 2022,1,97,150,UI_UX
Statistics for HCI,210576345,80.86686426,Alan Dix,Springer International Publishing,2022,Making Sense of Quantitative Data,,"Many people find statistics confusing, and perhaps even more confusing given recent publicity about problems with traditional p-values and alternative statistical techniques including confidence intervals and Bayesian statistics. This book aims to...",True,2022-05-31T00:00:00,May 2022,1,97,150,UI_UX
Social Media and Civic Engagement,210576347,48.51423626,Scott Robertson,Springer International Publishing,2022,"History, Theory, and Practice",,"Social media platforms are the latest manifestation in a series of sociotechnical innovations designed to enhance civic engagement, political participation, and global activism. While many researchers started out as optimists about the promise of...",True,2022-05-31T00:00:00,May 2022,1,97,150,UI_UX
Interface for an App—The design rationale leading to an app that allows someone with Type 1 diabetes to self-manage their condition,210576348,48.51423626,Bob Spence,Springer International Publishing,2022,,,This book is an account of how I addressed the need for a smartphone app that would allow someone with Type 1 diabetes to self-manage their condition.Its presentation highlights the major features of the app’s interface design. They include the...,True,2022-05-31T00:00:00,May 2022,1,97,150,UI_UX
The Art of Interaction,210576351,77.92571626,Ernest Edmonds,Springer International Publishing,2022,What HCI Can Learn from Interactive Art,,What can Human-Computer Interaction (HCI) learn from art? How can the HCI research agenda be advanced by looking at art research? How can we improve creativity support and the amplification of that important human capability? This book aims to answer these questions. Interactive art has become a common part of life as a result of the...,True,2022-05-31T00:00:00,May 2022,1,97,150,UI_UX
Humanistic HCI,210576352,66.16112426,Jeffrey Bardzell,Springer International Publishing,2022,,,"Although it has influenced the field of Human-Computer Interaction (HCI) since its origins, humanistic HCI has come into its own since the early 2000s. In that time, it has made substantial contributions to HCI theory and methodologies and also...",True,2022-05-31T00:00:00,May 2022,2,97,150,UI_UX
Toward Engineering Design Principles for HCI,210576355,73.51399426,John Long,Springer International Publishing,2022,,,This is the second of two books by the authors about engineering design principles for human-computer interaction (HCI-EDPs). The books report research that takes an HCI engineering discipline approach to acquiring initial such principles....,True,2022-05-31T00:00:00,May 2022,3,97,150,UI_UX
Usability Testing,210576362,48.51423626,Morten Hertzum,Springer International Publishing,2022,A Practitioner's Guide to Evaluating the User Experience,,"It is all too common for products, such as consumer appliances, information systems, mobile apps, and websites, to cause trouble and frustration. For example, products are often difficult or dull to use, make tasks less flexible or more tedious,...",True,2022-06-01T00:00:00,Jun 2022,1,97,150,UI_UX
Organizational Implementation,210576364,80.86686426,Morten Hertzum,Springer International Publishing,2022,The Design in Use of Information Systems,,"Information systems are part and parcel of organizations. Yet, organizations often struggle to realize the benefits that motivate their introduction of these systems. To derive benefit from a new information system, it must be integrated into the...",True,2022-06-01T00:00:00,Jun 2022,1,97,150,UI_UX
Disability Interactions,210576365,80.86686426,Catherine Holloway,Springer International Publishing,2022,Creating Inclusive Innovations,,"Disability interactions (DIX) is a new approach to combining cross-disciplinary methods and theories from Human Computer Interaction (HCI), disability studies, assistive technology, and social development to co-create new technologies,...",True,2022-05-31T00:00:00,May 2022,2,97,150,UI_UX
Ultrasound Mid-Air Haptics for Touchless Interfaces,210669251,132.33695426,Orestis Georgiou,Springer International Publishing,2022,,,"Over the last decade, ultrasound mid-air haptic technology has emerged and rapidly advanced to engage multidisciplinary scientific communities within and adjacent to the haptics and HCI fields. Additionally, this haptic technology has been adopted...",True,2022-09-16T00:00:00,Sep 2022,5,97,150,UI_UX
