Title,id,price,author,publisher,pub_year,s_tile,edition_num,description,availabe,sale_date,short_pub,num_of_author,width,height,cat_verification
Laws of UX,211206109,58.99,Jon Yablonski,O'Reilly Media,2024,, (2nd ed.),"An understanding of psychology-specifically the psychology behind how users behave and interact with digital interfaces-is perhaps the single most valuable nondesign skill a designer can have. The most elegant design can fail if it forces users to conform to the design instead of working within the ""blueprint"" of how humans perceive and process...",True,2024-01-23T00:00:00,Jan 2024,1,97,150,UI_UX
User-Centered Design,1162006,27.99,Travis Lowdermilk,O'Reilly Media,2013,A Developer's Guide to Building User-Friendly Applications,,"How do you design engaging applications that people love to use? This book demonstrates several ways to include valuable input from potential clients and customers throughout the process. With practical guidelines and insights from his own experience, author Travis Lowdermilk shows you how usability and user-centered design will dramatically...",True,2013-03-29T00:00:00,Mar 2013,1,97,150,UI_UX
Design Leadership,2468769,44.99,Richard Banfield,O'Reilly Media,2015,How Top Design Leaders Build and Grow Successful Organizations,,"What does it take to be the leader of a design firm or group? We often assume they have all the answers, but in this rapidly evolving industry they’re forced to find their way like the rest of us. So how do good design leaders manage? If you lead a design group, or want to understand the people who do, this insightful book explores...",True,2015-12-04T00:00:00,Dec 2015,1,97,150,UI_UX
Get Into UX,210408466,6.99,Vy Alechnavicius,Vytautas Alechnavicius,2021,A foolproof guide to getting your first user experience job,,"Get Into UX book is a career advice book written to help new and experienced designers get unstuck in their pursuits to get UX jobs. The UX field has been booming for years, and as a result, a landslide of new talent has been flooding the market. All of the newcomers want to learn user experience design or research as fast as possible and get...",True,2021-11-01T00:00:00,Nov 2021,1,97,150,UI_UX
UX Strategy,210244612,53.99,Jaime Levy,O'Reilly Media,2021,, (2nd ed.),"User experience (UX) strategy lies at the intersection of UX design and business strategy, but until now, there hasn't been an easy-to-apply framework for executing it. This hands-on guide introduces lightweight product strategy tools and techniques to help you and your team devise innovative digital solutions that people want. Author Jaime Levy...",True,2021-03-12T00:00:00,Mar 2021,1,97,150,UI_UX
Mapping Experiences,210172260,59.99,James Kalbach,O'Reilly Media,2020,, (2nd ed.),Customers who have inconsistent experiences with products and services are understandably frustrated. But it's worse for organizations that can't pinpoint the causes of these problems because they're too focused on processes. This updated book shows your team how to use alignment diagrams to turn valuable customer observations into actionable...,True,2020-11-23T00:00:00,Nov 2020,1,97,150,UI_UX
Interaction Design,209657771,84.0,Helen Sharp,Wiley,2019,Beyond Human-Computer Interaction, (5th ed.),"A new edition of the #1 text in the human computer Interaction field! Hugely popular with students and professionals alike, the Fifth Edition of Interaction Design is an ideal...",True,2019-04-03T00:00:00,Apr 2019,3,97,150,UI_UX
UX for Beginners,2504566,42.99,Joel Marsh,O'Reilly Media,2015,A Crash Course in 100 Short Lessons,,"Apps! Websites! Rubber Ducks! Naked Ninjas! This book has everything. If you want to get started in user experience design (UX), you've come to the right place: 100 self-contained lessons that cover the whole spectrum of fundamentals. Forget dry, technical material. This bookÃ¢??based on the wildly popular UX Crash Course from Joel MarshÃ¢??s...",True,2015-12-21T00:00:00,Dec 2015,1,97,150,UI_UX
About Face,1762072,72.0,Alan Cooper,Wiley,2014,The Essentials of Interaction Design, (4th ed.),"The essential interaction design guide, fully revised and updated for the mobile age About Face: The Essentials of Interaction Design, Fourth Edition is the latest update to the book that shaped and evolved the landscape of interaction design....",True,2014-08-05T00:00:00,Aug 2014,4,97,150,UI_UX
Designing with Data,95751187,56.99,Rochelle King,O'Reilly Media,2017,Improving the User Experience with A/B Testing,,"On the surface, design practices and data science may not seem like obvious partners. But these disciplines actually work toward the same goal, helping designers and product managers understand users so they can craft elegant digital experiences. While data can enhance design, design can bring deeper meaning to data. This practical guide shows...",True,2017-03-29T00:00:00,Mar 2017,3,97,150,UI_UX
Designing with the Mind in Mind,210101952,58.51820295,Jeff Johnson,Elsevier Science,2020,Simple Guide to Understanding User Interface Design Guidelines, (3rd ed.),"User interface (UI) design rules and guidelines, developed by early HCI gurus and recognized throughout the field, were based on cognitive psychology (study of mental processes such as problem solving, memory, and language), and early practitioners were well informed of its tenets. But today practitioners with backgrounds in cognitive...",True,2020-08-14T00:00:00,Aug 2020,1,97,150,UI_UX
Storytelling in Design,209909482,56.99,Anna Dahlström,O'Reilly Media,2019,"Defining, Designing, and Selling Multidevice Products",,"With the wide variety of devices, touch points, and channels in use, your ability to control how people navigate your well-crafted experiences is fading. Yet it’s still important to understand where people are in their journey if you’re to deliver the right content and interactions atthe right time and on the right device. This practical guide...",True,2019-12-12T00:00:00,Dec 2019,1,97,150,UI_UX
Learn WinUI 3.0,210256524,55.99,Alvin Ashcraft,Packt Publishing,2021,"Leverage the power of WinUI, the future of native Windows application development",,,True,2021-03-26T00:00:00,Mar 2021,1,97,150,UI_UX
Angular Cookbook,210336127,39.99,Muhammad Ahsan Ayaz,Packt Publishing,2021,Over 80 actionable recipes every Angular developer should know,,,True,2021-08-06T00:00:00,Aug 2021,2,97,150,UI_UX
Designing and Prototyping Interfaces with Figma,210495838,60.99,Fabio Staiano,Packt Publishing,2022,"Learn essential UX/UI design principles by creating interactive prototypes for mobile, tablet, and desktop",,,True,2022-03-16T00:00:00,Mar 2022,1,97,150,UI_UX
Android Programming with Kotlin for Beginners,209675188,39.99,John Horton,Packt Publishing,2019,Build Android apps starting from zero programming experience with the new Kotlin programming language,,,True,2019-04-30T00:00:00,Apr 2019,1,97,150,UI_UX
Designing with Sound,209546567,29.99,Amber Case,O'Reilly Media,2018,Fundamentals for Products and Services,,"Sound can profoundly impact how people interact with your product. Well-designed sounds can be exceptionally effective in conveying subtle distinctions, emotion, urgency, and information without adding visual clutter. In this practical guide, Amber Case and Aaron Day explain why sound design is critical to the success of products, environments,...",True,2018-11-26T00:00:00,Nov 2018,2,97,150,UI_UX
Learn WinUI 3,211127537,42.99,Alvin Ashcraft,Packt Publishing,2023,Leverage WinUI and the Windows App SDK to create modern Windows applications with C# and XAML,,,True,2023-10-31T00:00:00,Oct 2023,1,97,150,UI_UX
3D Graphics Rendering Cookbook,210343801,55.99,Sergey Kosarevsky,Packt Publishing,2021,A comprehensive guide to exploring rendering algorithms in modern OpenGL and Vulkan,,,True,2021-08-25T00:00:00,Aug 2021,2,97,150,UI_UX
Designing Interfaces,443495,39.99,Jenifer Tidwell,O'Reilly Media,2005,Patterns for Effective Interaction Design,,"Designing a good interface isn't easy. Users demand software that is well-behaved, good-looking, and easy to use. Your clients or managers demand originality and a short time to market. Your UI technology -- web applications, desktop software, even mobile devices -- may give you the tools you need, but little guidance on how to use them well. UI...",True,2008-03-14T00:00:00,Nov 2005,1,97,150,UI_UX
Understanding Industrial Design,2510881,34.99,Simon King,O'Reilly Media,2016,Principles for UX and Interaction Design,,"With the coming flood of connected products, many UX and interaction designers are looking into hardware design, a discipline largely unfamiliar to them. If you’re among those who want to blend digital and physical design concepts successfully, this practical book helps you explore seven long-standing principles of industrial design. Two present...",True,2016-01-20T00:00:00,Jan 2016,2,97,150,UI_UX
Vue.js 3 Cookbook,210125763,49.99,Heitor Ramon Ribeiro,Packt Publishing,2020,Discover actionable solutions for building modern web apps with the latest Vue features and TypeScript,,,True,2020-09-18T00:00:00,Sep 2020,1,97,150,UI_UX
Microinteractions: Full Color Edition,1465966,44.99,Dan Saffer,O'Reilly Media,2013,Designing with Details,,"It’s the little things that turn a good digital product into a great one. With this full color practical book, you’ll learn how to design effective microinteractions: the small details that exist inside and around features. How can users change a setting? How do they turn on mute, or know they have a new email message? Through vivid, real-world...",True,2013-10-10T00:00:00,Oct 2013,1,97,150,UI_UX
Learning Responsive Web Design,1710352,33.99,Clarissa Peterson,O'Reilly Media,2014,A Beginner's Guide,,"Deliver an optimal user experience to all devices—including tablets, smartphones, feature phones, laptops, and large screens—by learning the basics of responsive web design. In this hands-on guide, UX designer Clarissa Peterson explains how responsive web design works, and takes you through a responsive workflow from project kickoff to site...",True,2014-06-10T00:00:00,Jun 2014,1,97,150,UI_UX
Accessibility Handbook,1013438,15.99,Katie Cunningham,O'Reilly Media,2012,Making 508 Compliant Websites,,"Get practical guidelines for making your website accessible to people with disabilities. With this handbook, you’ll learn how to design or develop a site that conforms to Section 508 of the US Rehabilitation Act—and in the process you’ll discover how to provide a better user experience for everyone. The Accessibility Handbook introduces you to...",True,2012-08-27T00:00:00,Aug 2012,1,97,150,UI_UX
Designing Connected Products,2054962,49.99,Claire Rowland,O'Reilly Media,2015,UX for the Consumer Internet of Things,,"Networked thermostats, fitness monitors, and door locks show that the Internet of Things can (and will ) enable new ways for people to interact with the world around them. But designing connected products for consumers brings new challenges beyond conventional software UI and interaction design. This book provides experienced UX designers and...",True,2015-05-19T00:00:00,May 2015,5,97,150,UI_UX
UX for Business,211164308,53.99,Joel Marsh,O'Reilly Media,2023,,,"Many UX designers are surprised to learn that much of the job isn't about drawing things. It's about knowing what to draw and how to convince people to build it. Whether you're a one-person design team making products from scratch or a C-level product leader managing many products and strategies, UX for Business is your missing guide to...",True,2023-12-04T00:00:00,Dec 2023,1,97,150,UI_UX
Vue.js 3 By Example,210303669,44.99,John Au-Yeung,Packt Publishing,2021,"Blueprints to learn Vue web development, full-stack development, and cross-platform development quickly",,,True,2021-04-26T00:00:00,Apr 2021,1,97,150,UI_UX
Cross-Platform Development with Qt 6 and Modern C++.,210306523,55.99,Nibedit Dey,Packt Publishing,2021,Design and build applications with modern graphical user interfaces without worrying about platform dependency,,,True,2021-06-25T00:00:00,Jun 2021,1,97,150,UI_UX
Android UI Development with Jetpack Compose,211113603,40.99,Thomas Künneth,Packt Publishing,2023,Bring declarative and native UI to life quickly and easily on Android using Jetpack Compose and Kotlin,,,True,2023-11-03T00:00:00,Nov 2023,1,97,150,UI_UX
Visualize This,693541,47.99,Nathan Yau,Wiley,2011,"The FlowingData Guide to Design, Visualization, and Statistics",,Practical data design tips from a data visualization expert of the modern age Data doesn't decrease; it is ever-increasing and can be overwhelming to organize in a way that makes sense to its intended audience. Wouldn't...,True,2011-06-13T00:00:00,Jun 2011,1,97,150,UI_UX
Designing Voice User Interfaces,95659341,44.99,Cathy Pearl,O'Reilly Media,2016,Principles of Conversational Experiences,,"Voice user interfaces (VUIs) are becoming all the rage today. But how do you build one that people can actually converse with? Whether you’re designing a mobile app, a toy, or a device such as a home assistant, this practical book guides you through basic VUI design principles, helps you choose the right speech recognition engine, and shows you...",True,2016-12-21T00:00:00,Dec 2016,1,97,150,UI_UX
Hands-On Motion Graphics with Adobe After Effects CC,209672661,49.99,David Dodds,Packt Publishing,2019,Develop your skills as a visual effects and motion graphics artist,,,True,2019-04-27T00:00:00,Apr 2019,1,97,150,UI_UX
Bootstrap,1187284,17.99,Jake Spurlock,O'Reilly Media,2013,Responsive Web Development,,"Discover how easy it is to design killer interfaces and responsive websites with the Bootstrap framework. This practical book gets you started building pages with Bootstrap’s HTML/CSS-based tools and design templates right away. You’ll also learn how to extend your app with interactive features, using its suite of jQuery plugins—often without...",True,2013-05-08T00:00:00,May 2013,1,97,150,UI_UX
Visual Usability,1158375,61.18616475,Tania Schlatter,Elsevier Science,2013,Principles and Practices for Designing Digital Applications,,"Imagine how much easier creating web and mobile applications would be if you had a practical and concise, hands-on guide to visual design. Visual Usability gets into the nitty-gritty of applying visual design principles to complex application design.You’ll learn how to avoid common mistakes, make informed decisions about application...",True,2013-03-21T00:00:00,Mar 2013,2,97,150,UI_UX
C++ Game Development By Example,209748139,39.99,Siddharth Shekar,Packt Publishing,2019,"Learn to build games and graphics with SFML, OpenGL, and Vulkan using C++ programming",,,True,2019-05-03T00:00:00,May 2019,1,97,150,UI_UX
Designing Mobile Interfaces,801438,49.99,Steven Hoober,O'Reilly Media,2011,Patterns for Interaction Design,,"With hundreds of thousands of mobile applications available today, your app has to capture users immediately. This book provides practical techniques to help you catch—and keep—their attention. You’ll learn core principles for designing effective user interfaces, along with a set of common patterns for interaction design on all types of mobile...",True,2011-11-01T00:00:00,Nov 2011,2,97,150,UI_UX
Mobile Design Pattern Gallery,1680054,62.99,Theresa Neil,O'Reilly Media,2014,UI Patterns for Smartphone Apps, (2nd ed.),"When you’re under pressure to produce a well-designed, easy-to-navigate mobile app, there’s no time to reinvent the wheel—and no need to. This handy reference provides more than 90 mobile app design patterns, illustrated by 1,000 screenshots from current Android, iOS, and Windows Phone apps. Much has changed since this book’s first edition....",True,2014-04-23T00:00:00,Apr 2014,1,97,150,UI_UX
Designing Mobile Payment Experiences,1766634,28.99,Skip Allums,O'Reilly Media,2014,Principles and Best Practices for Mobile Commerce,,"Now that consumer purchases with mobile phones are on the rise, how do you design a payment app that’s safe, easy to use, and compelling? With this practical book, interaction and product designer Skip Allums provides UX best practices and recommendations to help you create familiar, friendly, and trustworthy experiences. Consumers want mobile...",True,2014-08-13T00:00:00,Aug 2014,1,97,150,UI_UX
Information Visualization,209920967,85.74230295,Colin Ware,Elsevier Science,2019,Perception for Design, (4th ed.),"Information Visualization: Perception for Design, Fourth Edition explores the art and science of why we see objects the way we do. Based on the science of perception and vision, the author presents the key principles at work for a wide range of applications--resulting in visualization of improved clarity, utility and persuasiveness....",True,2019-12-19T00:00:00,Dec 2019,1,97,150,UI_UX
Learn React Hooks,209821215,44.99,Daniel Bugl,Packt Publishing,2019,Build and refactor modern React.js applications using Hooks,,,True,2019-10-18T00:00:00,Oct 2019,1,97,150,UI_UX
Application Development with Qt Creator,209940868,39.99,Lee Zhi Eng,Packt Publishing,2020,Build cross-platform applications and GUIs using Qt 5 and C++,,,True,2020-01-31T00:00:00,Jan 2020,2,97,150,UI_UX
Building Vue.js Applications with GraphQL,210193112,39.99,Heitor Ramon Ribeiro,Packt Publishing,2021,"Develop a complete full-stack chat app from scratch using Vue.js, Quasar Framework, and AWS Amplify",,,True,2021-01-29T00:00:00,Jan 2021,1,97,150,UI_UX
From Chaos to Concept,210077469,42.0,Kevin Collamore Braun,Wiley,2020,A Team Oriented Approach to Designing World Class Products and Experiences,,"This book is written for product design, software development, graphic design, and UX professionals with a focus on creating measurably better user experiences. If you want to design...",True,2020-06-30T00:00:00,Jun 2020,1,97,150,UI_UX
Interaction Design,210778214,82.95,Yvonne Rogers,Wiley,2023,Beyond Human-Computer Interaction, (6th ed.),"A delightful, engaging, and comprehensive overview of interaction design Effective and engaging design is a critical component of any digital product, from virtual reality software to chatbots, smartphone apps,...",True,2023-02-24T00:00:00,Feb 2023,3,97,150,UI_UX
UI is Communication,1218201,61.18616475,Everett N McKay,Elsevier Science,2013,"How to Design Intuitive, User Centered Interfaces by Focusing on Effective Communication",,"User interface design is a challenging, multi-disciplinary activity that requires understanding a wide range of concepts and techniques that are often subjective and even conflicting. Imagine how much it would help if there were a single perspective that you could use to simplify these complex issues down to a small set of objective...",True,2013-05-24T00:00:00,May 2013,1,97,150,UI_UX
Visual Thinking for Information Design,210258038,74.85266295,Colin Ware,Elsevier Science,2021,, (2nd ed.),"Visual Thinking for Information Design, Second Edition brings the science of perception to the art of design. The book takes what we now know about perception, cognition and attention and transforms it into concrete advice that students and designers can directly apply. It demonstrates how designs can be considered as tools for...",True,2021-03-26T00:00:00,Mar 2021,1,97,150,UI_UX
101 UX Principles,96393872,66.99,Will Grant,Packt Publishing,2018,A definitive design guide,,,True,2018-08-31T00:00:00,Aug 2018,1,97,150,UI_UX
End-to-End Web Testing with Cypress,210218484,49.99,Waweru Mwaura,Packt Publishing,2021,Explore techniques for automated frontend web testing with Cypress and JavaScript,,,True,2021-01-29T00:00:00,Jan 2021,1,97,150,UI_UX
Hands-On Microsoft Lists,210313763,34.99,João Ferreira,Packt Publishing,2021,Create custom data models and improve the way data is organized using Lists in Microsoft 365,,,True,2021-07-16T00:00:00,Jul 2021,2,97,150,UI_UX
Expert Microsoft Teams Solutions,210542695,49.99,Aaron Guilmette,Packt Publishing,2022,A guide to Teams architecture and integration for advanced end users and administrators,,,True,2022-04-29T00:00:00,Apr 2022,4,97,150,UI_UX
Game Development with Rust and WebAssembly,210533158,44.99,Eric Smith,Packt Publishing,2022,Learn how to run Rust on the web while building a game,,,True,2022-04-29T00:00:00,Apr 2022,1,97,150,UI_UX
Clean Android Architecture,210571014,39.99,Alexandru Dumbravan,Packt Publishing,2022,"Take a layered approach to writing clean, testable, and decoupled Android applications",,,True,2022-06-20T00:00:00,Jun 2022,2,97,150,UI_UX
Building Games with Flutter,210579040,39.99,Paul Teale,Packt Publishing,2022,The ultimate guide to creating multiplatform games using the Flame engine in Flutter 3,,,True,2022-06-30T00:00:00,Jun 2022,1,97,150,UI_UX
The Missing Bootstrap 5 Guide,210636935,37.99,Jeppe Schaumburg Jensen,Packt Publishing,2022,Customize and extend Bootstrap 5 with Sass and JavaScript to create unique website designs,,,True,2022-08-26T00:00:00,Aug 2022,1,97,150,UI_UX
Cross-Platform UIs with Flutter,210657437,37.99,Ryan Edge,Packt Publishing,2022,Unlock the ability to create native multiplatform UIs using a single code base with Flutter 3,,,True,2022-08-26T00:00:00,Aug 2022,2,97,150,UI_UX
Mastering CSS Grid,210844550,37.99,Pascal Thormeier,Packt Publishing,2023,A comprehensive and practical guide to creating beautiful layouts with CSS Grid,,,True,2023-06-09T00:00:00,Jun 2023,1,97,150,UI_UX
The MVVM Pattern in .NET MAUI,211163288,46.99,Pieter Nijs,Packt Publishing,2023,"The definitive guide to essential patterns, best practices, and techniques for cross-platform app development",,,True,2023-11-30T00:00:00,Nov 2023,2,97,150,UI_UX
"HCI for Cybersecurity, Privacy and Trust",210329777,73.51399426,Abbas Moallem,Springer International Publishing,2021,"Third International Conference, HCI-CPT 2021, Held as Part of the 23rd HCI International Conference, HCII 2021, Virtual Event, July 24–29, 2021, Proceedings",,"This book constitutes the refereed proceedings of the Third International Conference on HCI for Cybersecurity, Privacy and Trust, HCI-CPT 2021, held as part of the 23rd International Conference, HCI International 2021, which took place virtually...",True,2021-07-03T00:00:00,Jul 2021,1,97,150,UI_UX
Conceptual Models,210576304,39.69079226,Jeff Johnson,Springer International Publishing,2022,Core to Good Design,,"People make use of software applications in their activities, applying them as tools in carrying out tasks. That this use should be good for people--easy, effective, efficient, and enjoyable--is a principal goal of design. In this book, we present the notion of Conceptual Models, and argue that Conceptual Models are core to achieving...",True,2022-05-31T00:00:00,May 2022,2,97,150,UI_UX
UX Decoded,210582235,20.35001475,Dushyant Kanungo,BPB Publications,2022,"Think and Implement User-Centered Research Methodologies, and Expert-Led UX Best Practices",,"This book aims to provide UX professionals with the information, tools, and techniques they need to apply a user-centric approach to product design. It will show you how to learn about your customers&#39; wants and create products that they will enjoy.The book takes the reader on a journey that begins with learning to understand user behavior,...",True,2022-04-23T00:00:00,Apr 2022,1,97,150,UI_UX
Universal Principles of UX,210705173,53.0,Irene Pereyra,Rockport Publishers,2023,100 Timeless Strategies to Create Positive Interactions between People and Technology,,"Universal Principles of UX is a comprehensive, cross-disciplinary encyclopedia for user experience designers.",True,2023-03-07T00:00:00,Mar 2023,1,97,150,UI_UX
Handbook of Usability Testing,343716,76.0,Jeffrey Rubin,Wiley,2008,"How to Plan, Design, and Conduct Effective Tests", (2nd ed.),"Whether it's software, a cell phone, or a refrigerator, your customer wants - no, expects - your product to be easy to use. This fully revised handbook provides clear, step-by-step guidelines to help you test your product for usability. Completely...",True,2008-04-30T00:00:00,Apr 2008,3,97,150,UI_UX
Rapid Contextual Design,226809,77.52062475,Karen Holtzblatt,Elsevier Science,2004,A How-to Guide to Key Techniques for User-Centered Design,,"Is it impossible to schedule enough time to include users in your design process? Is it difficult to incorporate elaborate user-centered design techniques into your own standard design practices? Do the resources needed seem overwhelming? This handbook introduces Rapid CD, a fast-paced, adaptive form of Contextual Design. Rapid CD is...",True,2004-12-31T00:00:00,Dec 2004,3,97,150,UI_UX
The Essential Guide to User Interface Design,291460,101.0,Wilbert O. Galitz,Wiley,2007,An Introduction to GUI Design Principles and Techniques, (3rd ed.),"Bringing together the results of more than 300 new design studies, an understanding of people, knowledge of hardware and software capabilities, and the author’s practical experience gained from 45 years of work with display-based systems, this...",True,2007-04-10T00:00:00,Apr 2007,1,97,150,UI_UX
"HCI Models, Theories, and Frameworks",294610,108.82833975,John M. Carroll,Elsevier Science,2003,Toward a Multidisciplinary Science,,"HCI Models, Theories, and Frameworks provides a thorough pedagological survey of the science of Human-Computer Interaction (HCI). HCI spans many disciplines and professions, including anthropology, cognitive psychology, computer graphics, graphical design, human factors engineering, interaction design, sociology, and software...",True,2003-05-21T00:00:00,May 2003,1,97,150,UI_UX
